{
  "schema_version": "2.0-rc1",
  "issue_id": "SP-beyond-text-2026",
  "research_profile": "THEMATIC",
  "publication_profile": "LONGFORM_SPECIAL",
  "lifecycle_state": "CANDIDATES_NORMALIZED",
  "profile": {
    "path": "sources/SP-beyond-text-2026/production-profile.json",
    "sha256": "9fb37cbf9c8401f80f898e2c2a62e7e24cd44ec0819fec9e1b1732dbc27a2bdb"
  },
  "contract": {
    "pipeline_contract_version": "2.0-rc1",
    "pipeline_contract_sha256": "ee89796245c22072cec98f34931180214a4928c24f399280793cd6420a4c8e71",
    "quality_contract_version": "2.0-rc1",
    "quality_contract_sha256": "b5b955d524fb438c0f1b2c9490bea1da2083e79028d67a55ca424bbfc20f2958",
    "research_profile_version": "2.0-rc1",
    "research_profile_sha256": "0f575e6d97caec72b2bf8b7f6b78a562d97ca67b2071193417b968ba3d73e6e8",
    "publication_profile_version": "2.0-rc1",
    "publication_profile_sha256": "a6859559dd1b9d42ab8fb4402b74b7bdd8611dbe65c8e02a7b022b545c20f4eb"
  },
  "implementation": {
    "repository_commit_sha": "95c03bf5285cb4b2c1103a14c460574183a8cb93",
    "orchestrator_version": "survey-production-core-v2/0.15-postintegration-transport-thematic"
  },
  "human_gates": {
    "architecture_review": "pending",
    "publication_preview": "pending"
  },
  "human_gate_provenance": {
    "architecture_review": null,
    "publication_preview": null
  },
  "target_gate": "ARCHITECTURE_REVIEW",
  "next_action": "stage:evidence-materiality-completeness",
  "terminal_reason": null,
  "exception_gate": {
    "status": "inactive",
    "reason": null
  },
  "machine_checkpoints": {
    "discovery": "passed",
    "screening": "passed",
    "evidence": "pending",
    "materiality": "pending",
    "completeness": "pending",
    "selection": "pending",
    "architecture": "pending",
    "draft": "pending",
    "validation": "pending",
    "publication_preview": "pending",
    "freeze": "pending",
    "release": "pending"
  },
  "checkpoint_provenance": {
    "discovery": {
      "path": "sources/SP-beyond-text-2026/orchestration/v2/checkpoints/ISSUE_INITIALIZED.json",
      "sha256": "1eb355c707472f51182ae1ab943640ab2d4cca899895fd0c60fc8e4eccd12754"
    },
    "screening": {
      "path": "sources/SP-beyond-text-2026/orchestration/v2/checkpoints/DISCOVERY_COLLECTED.json",
      "sha256": "acd6020d2bd6bf07073304113a41f70ad5719a6616be651f204668ee7d7f3b0a"
    },
    "evidence": null,
    "materiality": null,
    "completeness": null,
    "selection": null,
    "architecture": null,
    "draft": null,
    "validation": null,
    "publication_preview": null,
    "freeze": null,
    "release": null
  },
  "legacy_compatibility": {
    "mode": "NON_AUTHORITATIVE_READ_ONLY",
    "legacy_state_path": "sources/SP-beyond-text-2026/pipeline-state.json",
    "legacy_state_present": false,
    "legacy_state_sha256": null
  },
  "history": [
    {
      "from": null,
      "to": "ISSUE_INITIALIZED",
      "recorded_at": "2026-09-23T17:03:09Z",
      "repository_commit_sha": "95c03bf5285cb4b2c1103a14c460574183a8cb93"
    },
    {
      "from": "ISSUE_INITIALIZED",
      "to": "DISCOVERY_COLLECTED",
      "recorded_at": "2026-09-24T12:37:27Z",
      "repository_commit_sha": "d2234bfe350c20e7c91859df9088af50f36b92d0"
    },
    {
      "from": "DISCOVERY_COLLECTED",
      "to": "CANDIDATES_NORMALIZED",
      "recorded_at": "2026-09-24T12:40:35Z",
      "repository_commit_sha": "d2234bfe350c20e7c91859df9088af50f36b92d0"
    }
  ]
}
